Symbol,Name,Last Sale,Net Change,% Change,Market Cap,Country,IPO Year,Volume,Sector,Industry
CRS,Carpenter Technology Corporation Common Stock,$33.71,-0.23,-0.678%,1620344098.00,United States,,99874,Basic Industries,Steel/Iron Ore
CRT,Cross Timbers Royalty Trust Common Stock,$14.885,-0.115,-0.767%,89310000.00,United States,1992,36743,Energy,Oil & Gas Production
CRU,Crucible Acquisition Corporation Class A Common Stock,$9.74,0.01,0.103%,315028125.00,,2021,1309,,
CRY,CryoLife Inc. Common Stock,$23.11,-0.29,-1.239%,908368870.00,United States,,43809,Health Care,Medical/Dental Instruments
CS,Credit Suisse Group American Depositary Shares,$9.995,-0.165,-1.624%,24100627498.00,Switzerland,,2666224,Finance,Investment Bankers/Brokers/Service
CSAN,Cosan S.A. ADS,$16.89,-0.59,-3.375%,7887525620.00,,2021,48832,Consumer Durables,Automotive Aftermarket
CSL,Carlisle Companies Incorporated Common Stock,$204.08,-3.29,-1.587%,10637791632.00,United States,,76339,,
CSLT,Castlight Health Inc. Class B Common Stock,$1.615,-0.015,-0.92%,258806767.00,,2014,317352,Health Care,Managed Health Care
CSPR,Casper Sleep Inc. Common Stock,$4.825,-0.165,-3.307%,199990233.00,,2020,364191,Consumer Durables,Home Furnishings
CSR,D/B/A Centerspace Common Stock,$97.17,-0.45,-0.461%,1364739046.00,United States,,20908,Consumer Services,Building operators
CSR^C,D/B/A Centerspace 6.625% Series C ,$25.65,-0.08,-0.311%,,United States,,800,,
CSTM,Constellium SE Ordinary Shares (France),$19.72,0.22,1.128%,2793877658.00,Netherlands,2013,475510,Basic Industries,Aluminum
CSU,Capital Senior Living Corporation Common Stock,$35.00,-0.50,-1.408%,76670965.00,United States,1997,26251,Health Care,Hospital/Nursing Management
CSV,Carriage Services Inc. Common Stock,$45.00,0.05,0.111%,802157580.00,United States,,54919,Miscellaneous,Other Consumer Services
CTA^A,E.I. du Pont de Nemours and Company Preferred Stock,$94.875,0.00,0.00%,,United States,,154,,
CTA^B,E.I. du Pont de Nemours and Company Preferred Stock,$113.8512,0.00,0.00%,,United States,,139,,
CTAC,Cerberus Telecom Acquisition Corp. Class A Ordinary Shares,$9.91,-0.09,-0.90%,330695957.00,United States,2020,128008,Finance,Business Services
CTBB,Qwest Corporation 6.5% Notes due 2056,$25.65,-0.04,-0.156%,0.00,United States,2016,59228,,
CTDD,Qwest Corporation 6.75% Notes due 2057,$26.411,-0.029,-0.11%,0.00,United States,2017,23669,,
CTK,CooTek (Cayman) Inc. American Depositary Shares each representing 50 Class A Ordinary Shares,$1.26,-0.05,-3.817%,82542038.00,,2018,71434,Technology,EDP Services
CTLT,Catalent Inc. Common Stock,$133.33,-3.06,-2.244%,22780781133.00,United States,2014,527834,Health Care,Biotechnology: Pharmaceutical Preparations
CTO,CTO Realty Growth Inc. Common Stock,$53.215,-0.255,-0.477%,316977276.00,United States,,8330,Consumer Services,Real Estate Investment Trusts
CTO^A,CTO Realty Growth Inc. 6.375% Series A Cumulative Redeemable Preferred Stock,$25.80,-0.1027,-0.396%,,United States,,1451,,
CTOS,Custom Truck One Source Inc. Common Stock,$9.29,-0.09,-0.959%,2294250829.00,Cayman Islands,2017,178554,Technology,Diversified Commercial Services
CTR,ClearBridge MLP and Midstream Total Return Fund Inc. Common Stock,$24.37,-0.21,-0.854%,173455888.00,United States,2012,9584,Finance,Investment Managers
CTS,CTS Corporation Common Stock,$31.26,-0.40,-1.263%,1013654703.00,United States,,58778,Capital Goods,Industrial Machinery/Components
CTT,CatchMark Timber Trust Inc. Class A Common Stock,$11.85,-0.16,-1.332%,579455212.00,United States,2013,55991,Consumer Services,Real Estate Investment Trusts
CTVA,Corteva Inc. Common Stock ,$42.9678,-0.4922,-1.133%,31546314243.00,,2019,992163,Basic Industries,Major Chemicals
CUBB,Customers Bancorp Inc 5.375% Subordinated Notes Due 2034,$26.95,-0.15,-0.554%,0.00,United States,2019,635,Finance,Major Banks
CUBE,CubeSmart Common Shares,$49.281,0.041,0.083%,9943432643.00,United States,,385847,Consumer Services,Real Estate Investment Trusts
CUBI,Customers Bancorp Inc Common Stock,$41.93,0.18,0.431%,1357439933.00,United States,,123878,Finance,Major Banks
CUBI^E,Customers Bancorp Inc Fixed-to-Floating Rate Non-Cumulative Perpetual Preferred Stock Series E,$25.25,0.03,0.119%,,United States,,1414,,
CUBI^F,Customers Bancorp Inc Fixed-to-Floating Rate Non-Cumulative Perpetual Preferred Stock Series F,$25.30,0.05,0.198%,,United States,,4015,,
CUK,Carnival Plc ADS ADS,$24.03,-0.11,-0.456%,27843902610.00,United States,,910448,,
CULP,Culp Inc. Common Stock,$12.54,-0.01,-0.08%,153029181.00,United States,,1604,Basic Industries,Textiles
CURO,CURO Group Holdings Corp. Common Stock,$17.505,0.345,2.01%,725225866.00,,2017,71157,Finance,Diversified Financial Services
CURV,Torrid Holdings Inc. Common Stock,$17.05,0.01,0.059%,1876871638.00,,2021,106226,Consumer Services,Clothing/Shoe/Accessory Stores
CUZ,Cousins Properties Incorporated Common Stock,$37.82,-0.20,-0.526%,5623381522.00,United States,,236574,Consumer Services,Real Estate Investment Trusts
CVA,Covanta Holding Corporation Common Stock,$20.135,0.045,0.224%,2678139880.00,United States,,345122,,
CVE,Cenovus Energy Inc Common Stock,$9.985,0.065,0.655%,20145855820.00,Canada,,8134887,Energy,Oil & Gas Production
CVEO,Civeo Corporation (Canada) Common Shares,$22.74,-0.73,-3.11%,325552071.00,,2014,10732,,
CVI,CVR Energy Inc. Common Stock,$16.62,-0.01,-0.06%,1670818555.00,United States,2007,338226,Energy,Integrated oil Companies
CVII,Churchill Capital Corp VII Class A Common Stock,$9.73,-0.015,-0.154%,1678425000.00,,2021,35832,,
CVNA,Carvana Co. Class A Common Stock,$307.175,-11.945,-3.743%,25956917516.00,United States,2017,774474,Consumer Services,Other Specialty Stores
CVS,CVS Health Corporation Common Stock,$85.70,-0.04,-0.047%,113087555561.00,United States,,2956630,Health Care,Managed Health Care
CVX,Chevron Corporation Common Stock,$103.87,0.90,0.874%,200875433623.00,United States,,8768075,Energy,Integrated oil Companies
CW,Curtiss-Wright Corporation Common Stock,$126.15,-1.43,-1.121%,5157516474.00,United States,,90623,Capital Goods,Industrial Machinery/Components
CWAN,Clearwater Analytics Holdings Inc. Class A Common Stock,$25.829,0.619,2.455%,4467121521.00,,2021,806545,Technology,Computer Software: Prepackaged Software
CWEN,Clearway Energy Inc. Class C Common Stock,$30.44,-0.41,-1.329%,3542007897.00,United States,2015,225164,Public Utilities,Electric Utilities: Central
CWH,Camping World Holdings Inc. Class A Commom Stock,$41.305,0.465,1.139%,3617057908.00,United States,2016,685489,Capital Goods,Recreational Products/Toys
CWK,Cushman & Wakefield plc Ordinary Shares,$18.51,-0.05,-0.269%,4132327236.00,,2018,640485,Finance,Real Estate
CWT,California Water Service Group Common Stock,$58.91,-0.08,-0.136%,3035926850.00,United States,,45055,Public Utilities,Water Supply
CX,Cemex S.A.B. de C.V. Sponsored ADR,$7.31,-0.20,-2.663%,10766877596.00,Mexico,,2009503,Capital Goods,Building Materials
CXE,MFS High Income Municipal Trust Common Stock,$5.27,-0.07,-1.311%,166129730.00,United States,1989,55080,Finance,Investment Managers
CXH,MFS Investment Grade Municipal Trust Common Stock,$10.0301,-0.1099,-1.084%,91376668.00,United States,1989,19693,Finance,Investment Managers
CXM,Sprinklr Inc. Class A Common Stock,$18.42,-0.27,-1.445%,4697722117.00,,2021,182738,Technology,Computer Software: Prepackaged Software
CXP,Columbia Property Trust Inc. Common Stock,$19.015,-0.005,-0.026%,2184799408.00,United States,2013,1328931,Consumer Services,Real Estate Investment Trusts
CXW,CoreCivic Inc. Common Stock,$8.82,0.10,1.147%,1060911627.00,United States,,313143,Consumer Services,Real Estate Investment Trusts
CYD,China Yuchai International Limited Common Stock,$13.655,-0.115,-0.835%,557919950.00,Singapore,1994,16023,Capital Goods,Construction/Ag Equipment/Trucks
CYH,Community Health Systems Inc. Common Stock,$11.965,0.115,0.97%,1580314538.00,United States,2000,503035,Health Care,Hospital/Nursing Management
CZOO,Cazoo Group Ltd Class A Ordinary Shares,$8.35,-0.50,-5.65%,6280476206.00,,,587482,Consumer Durables,Automotive Aftermarket
D,Dominion Energy Inc. Common Stock,$72.97,-0.84,-1.138%,58995320032.00,United States,,1317270,Public Utilities,Electric Utilities: Central
DAC,Danaos Corporation Common Stock,$81.38,-0.33,-0.404%,1676341737.00,Greece,2006,209095,Transportation,Marine Transportation
DAL,Delta Air Lines Inc. Common Stock,$43.79,0.01,0.023%,28021872508.00,United States,,5460805,Transportation,Air Freight/Delivery Services
DAN,Dana Incorporated Common Stock ,$23.90,-0.24,-0.994%,3470968726.00,United States,,404324,Capital Goods,Auto Parts:O.E.M.
DAO,Youdao Inc. American Depositary Shares each representing one Class A Ordinary Share,$11.43,-0.53,-4.431%,1417102327.00,,2019,109668,Consumer Services,Other Consumer Services
DAR,Darling Ingredients Inc. Common Stock,$74.68,0.07,0.094%,12103372365.00,United States,,588069,Consumer Non-Durables,Farming/Seeds/Milling
DASH,DoorDash Inc. Class A Common Stock,$207.05,-9.68,-4.466%,69969736589.00,,2020,1253288,Capital Goods,Industrial Machinery/Components
DAVA,Endava plc American Depositary Shares (each representing one Class A Ordinary Share),$125.535,7.765,6.593%,6919155905.00,,2018,342813,Technology,EDP Services
DB,Deutsche Bank AG Common Stock,$12.73,-0.27,-2.077%,26271324947.00,Germany,,1903892,Finance,Commercial Banks
DBD,Diebold Nixdorf Incorporated Common Stock,$10.525,0.005,0.048%,824673819.00,United States,,147450,Technology,EDP Services
DBI,Designer Brands Inc. Class A Common Stock,$15.575,0.205,1.334%,1136969502.00,United States,,896310,Consumer Services,Clothing/Shoe/Accessory Stores
DBL,DoubleLine Opportunistic Credit Fund Common Shares of Beneficial Interest,$19.6775,-0.1525,-0.769%,294611805.00,United States,2012,22559,,
DBRG,DigitalBridge Group Inc.,$6.06,-0.25,-3.962%,2988198841.00,United States,2014,4231253,Consumer Services,Real Estate Investment Trusts
DBRG^H,DigitalBridge Group Inc. 7.125% Series H ,$25.6066,-0.1334,-0.518%,,United States,,2737,,
DBRG^I,DigitalBridge Group Inc. 7.15% Series I ,$25.5901,-0.1599,-0.621%,,United States,,5856,,
DBRG^J,DigitalBridge Group Inc. 7.125% Series J ,$25.94,-0.10,-0.384%,,United States,,58869,,
DCF,BNY Mellon Alcentra Global Credit Income 2024 Target Term Fund Inc. Common Stock,$9.53,-0.02,-0.209%,142598648.00,,2017,3043,Finance,Finance/Investors Services
DCI,Donaldson Company Inc. Common Stock,$59.84,-0.06,-0.10%,7514989405.00,United States,,188083,Capital Goods,Pollution Control Equipment
DCO,Ducommun Incorporated Common Stock,$50.47,-1.39,-2.68%,601618651.00,United States,,7922,Capital Goods,Military/Government/Technical
DCP,DCP Midstream  LP Common Units ,$28.12,-0.15,-0.531%,5859155525.00,United States,,173640,Public Utilities,Natural Gas Distribution
DCP^B,DCP Midstream LP 7.875% Series B Fixed-to-Floating Rate Cumulative Redeemable Perpetual Preferred Units,$24.69,-0.12,-0.484%,,United States,,6213,,
DCP^C,DCP Midstream LP 7.95% Series C Fixed-to-Floating Rate Cumulative Redeemable Perpetual Preferred Units,$24.95,-0.04,-0.16%,,United States,,10154,,
DCUE,Dominion Energy Inc. 2019 Series A Corporate Units,$97.3899,-0.9101,-0.926%,0.00,United States,2019,12272,Public Utilities,Electric Utilities: Central
DD,DuPont de Nemours Inc. Common Stock,$69.30,-0.81,-1.155%,36247828756.00,,2017,1167823,Capital Goods,Wholesale Distributors
DDD,3D Systems Corporation Common Stock,$28.87,-0.92,-3.088%,3615549809.00,United States,,803812,Technology,Computer peripheral equipment
DDF,Delaware Investments Dividend & Income Fund Inc. Common Stock,$10.95,-0.06,-0.545%,83342180.00,United States,1993,5703,Finance,Finance/Investors Services
DDL,Dingdong (Cayman) Limited American Depositary Shares (each two representing three Ordinary Shares),$23.51,-0.06,-0.255%,5549566839.00,,2021,13586,,
DDS,Dillard's Inc. Common Stock,$202.87,-0.98,-0.481%,4181809622.00,United States,,126466,Consumer Services,Department/Specialty Retail Stores
DDT,Dillard's Capital Trust I,$27.18,0.06,0.221%,0.00,United States,,8760,Consumer Services,Department/Specialty Retail Stores
DE,Deere & Company Common Stock,$355.89,3.47,0.985%,110347779405.00,United States,,1076160,Capital Goods,Industrial Machinery/Components
DEA,Easterly Government Properties Inc. Common Stock,$20.80,-0.01,-0.048%,1746062032.00,United States,2015,325548,Consumer Services,Real Estate Investment Trusts
DECK,Deckers Outdoor Corporation Common Stock,$376.2975,-6.1925,-1.619%,10409437591.00,United States,1993,241128,Consumer Non-Durables,Shoe Manufacturing
DEI,Douglas Emmett Inc. Common Stock,$32.70,-0.11,-0.335%,5737949834.00,United States,2006,383835,Consumer Services,Real Estate Investment Trusts
DELL,Dell Technologies Inc. Class C Common Stock ,$105.08,0.21,0.20%,80398405147.00,,2018,1112568,Technology,Computer Manufacturing
DEN,Denbury Inc. Common Stock,$72.745,-2.275,-3.033%,3645248313.00,,2020,465811,Energy,Oil & Gas Production
DEO,Diageo plc Common Stock,$190.07,-1.35,-0.705%,110822236248.00,United Kingdom,,228653,Consumer Non-Durables,Beverages (Production/Distribution)
DESP,Despegar.com Corp. Ordinary Shares,$12.09,-0.42,-3.357%,847500876.00,,2017,138883,Transportation,Other Consumer Services
DEX,Delaware Enhanced Global Dividend Common Shares of Beneficial Interest,$10.15,-0.14,-1.361%,114736940.00,United States,2007,40818,Finance,Finance Companies
DFIN,Donnelley Financial Solutions Inc. Common Stock ,$34.95,-0.54,-1.522%,1174558813.00,,2016,76880,Finance,Investment Managers
DFP,Flaherty & Crumrine Dynamic Preferred and Income Fund Inc. Common Stock,$28.4908,-0.2742,-0.953%,551947596.00,,2013,43568,Finance,Investment Managers
DFS,Discover Financial Services Common Stock,$129.91,-1.32,-1.006%,38903945040.00,United States,,776187,Finance,Finance: Consumer Services
DG,Dollar General Corporation Common Stock,$215.20,-1.56,-0.72%,50208358914.00,United States,2009,811225,Consumer Services,Department/Specialty Retail Stores
DGX,Quest Diagnostics Incorporated Common Stock,$145.56,-4.32,-2.882%,17784631280.00,United States,,929183,Health Care,Medical Specialities
DHF,BNY Mellon High Yield Strategies Fund Common Stock,$3.245,-0.035,-1.067%,235936448.00,United States,1998,91764,Finance,Finance Companies
DHI,D.R. Horton Inc. Common Stock,$85.14,-2.19,-2.508%,30496674281.00,United States,,1366709,,
DHR,Danaher Corporation Common Stock,$302.49,-13.51,-4.275%,215947479417.00,United States,,2319125,Health Care,Medical Specialities
DHR^A,Danaher Corporation 4.75% Mandatory Convertible Preferred Stock Series A,$2120.85,0.00,0.00%,,United States,,21081,,
DHR^B,Danaher Corporation 5.00% Mandatory Convertible Preferred Stock Series B,$1625.38,-56.77,-3.375%,,United States,,363,,
DHT,DHT Holdings Inc.,$6.35,0.08,1.276%,1066280462.00,Jersey,2005,1850388,Transportation,Marine Transportation
DHX,DHI Group Inc. Common Stock,$4.33,-0.21,-4.626%,217538182.00,United States,2007,80733,Technology,Diversified Commercial Services
DIAX,Nuveen Dow 30SM Dynamic Overwrite Fund Common Shares of Beneficial Interest,$16.8995,-0.2005,-1.173%,614582646.00,,2014,50640,Finance,Finance Companies
DIDI,DiDi Global Inc. American Depositary Shares (each four representing one Class A Ordinary Share),$8.0364,-0.2036,-2.471%,38761497798.00,,2021,6496721,,
DIN,Dine Brands Global Inc. Common Stock,$86.04,-0.38,-0.44%,1477824589.00,United States,,71350,Consumer Services,Restaurants
DIS,Walt Disney Company (The) Common Stock,$174.76,-3.50,-1.963%,317561043742.00,United States,,5148403,Consumer Services,Movies/Entertainment
DK,Delek US Holdings Inc. Common Stock,$18.34,-0.54,-2.86%,1358300326.00,United States,2017,391184,Energy,Integrated oil Companies
DKL,Delek Logistics Partners L.P. Common Units representing Limited Partner Interests,$45.84,-0.72,-1.546%,1991905369.00,United States,2012,6316,Energy,Oil & Gas Production
DKS,Dick's Sporting Goods Inc Common Stock,$128.83,-1.99,-1.521%,11412777998.00,United States,2002,784534,Consumer Services,Other Specialty Stores
DLB,Dolby Laboratories Common Stock,$90.30,-1.42,-1.548%,9155289083.00,United States,2005,97987,Technology,EDP Services
DLNG,Dynagas LNG Partners LP Common Units,$2.95,-0.06,-1.993%,108566629.00,Greece,,75281,,
DLNG^A,Dynagas LNG Partners LP 9.00% Series A Cumulative Redeemable Preferred Units,$25.37,0.00,0.00%,,Greece,,240,,
DLNG^B,Dynagas LNG Partners LP 8.75% Series B Fixed to Floating Rate Cumulative Redeemable Perpetual Preferred Units liquidation preference $25.00 per Uni,$24.86,0.012,0.048%,,Greece,,1991,,
DLR,Digital Realty Trust Inc. Common Stock,$143.79,-3.99,-2.70%,40796683738.00,United States,2004,1412802,Consumer Services,Real Estate Investment Trusts
DLR^J,Digital Realty Trust Inc. 5.250% Series J Cumulative Redeemable Preferred Stock,$25.964,-0.006,-0.023%,,United States,,3680,,
DLR^K,Digital Realty Trust Inc. 5.850% Series K Cumulative Redeemable Preferred Stock par value $0.01 per share,$27.06,0.04,0.148%,,United States,,25207,,
DLR^L,Digital Realty Trust Inc. 5.200% Series L Cumulative Redeemable Preferred Stock,$26.845,-0.245,-0.904%,,United States,,5812,,
DLX,Deluxe Corporation Common Stock,$36.60,0.08,0.219%,1557138582.00,United States,,45391,Technology,Advertising
DLY,DoubleLine Yield Opportunities Fund Common Shares of Beneficial Interest,$18.93,-0.16,-0.838%,907613596.00,,2020,160185,Finance,Investment Managers
DM,Desktop Metal Inc. Class A Common Stock,$7.48,-0.35,-4.47%,1949890589.00,,2019,3355243,Technology,Computer peripheral equipment
DMB,BNY Mellon Municipal Bond Infrastructure Fund Inc. Common Stock,$15.566,-0.314,-1.977%,286296830.00,,2013,13339,Finance,Trusts Except Educational Religious and Charitable
DMO,Western Asset Mortgage Opportunity Fund Inc. Common Stock,$16.00,-0.10,-0.621%,181209904.00,United States,2010,36932,Finance,Trusts Except Educational Religious and Charitable
DMS,Digital Media Solutions Inc. Class A Ordinary Shares,$7.385,-0.115,-1.533%,459104986.00,United States,2018,15638,Technology,Advertising
DMYI,dMY Technology Group Inc. III Class A Common Stock,$11.515,-0.425,-3.559%,431812500.00,United States,2021,4067711,,
DMYQ,dMY Technology Group Inc. IV Class A Common Stock,$9.9701,-0.0099,-0.099%,429960563.00,,2021,66134,,
DNA,Ginkgo Bioworks Holdings Inc. Class A Common Stock,$12.58,-0.70,-5.271%,24623953570.00,United States,2021,5077597,Health Care,Biotechnology: Biological Products (No Diagnostic Substances)
DNB,Dun & Bradstreet Holdings Inc. Common Stock,$16.95,-0.31,-1.796%,7306880309.00,United States,2020,1435613,Technology,EDP Services
DNMR,Danimer Scientific Inc. Common Stock,$17.23,-0.83,-4.596%,1683923721.00,,2020,801721,Consumer Non-Durables,Plastic Products
DNOW,NOW Inc. Common Stock,$7.91,0.16,2.065%,874520353.00,,2014,309223,Energy,Metal Fabrications
DNP,DNP Select Income Fund Inc. Common Stock,$10.73,-0.08,-0.74%,3658676804.00,United States,1987,483626,Finance,Investment Managers
DNZ,D and Z Media Acquisition Corp. Class A Common Stock,$9.72,0.00,0.00%,349312500.00,,2021,2,,
DOC,Physicians Realty Trust Common Shares of Beneficial Interest,$17.80,-0.23,-1.276%,3869824450.00,United States,2013,1114275,Consumer Services,Real Estate Investment Trusts
DOCN,DigitalOcean Holdings Inc. Common Stock,$78.05,-3.68,-4.503%,8377898317.00,,2021,1587836,Technology,Retail: Computer Software & Peripheral Equipment
DOCS,Doximity Inc. Class A Common Stock,$81.165,-6.395,-7.304%,15070095638.00,,2021,1637387,Technology,Retail: Computer Software & Peripheral Equipment
DOLE,Dole plc Ordinary Shares,$15.06,0.39,2.658%,1402065579.00,,2021,378117,,
DOMA,Doma Holdings Inc. Common Stock,$7.18,-0.32,-4.267%,2317614149.00,,2021,239067,Finance,Real Estate
DOOR,Masonite International Corporation Ordinary Shares (Canada),$111.68,-0.68,-0.605%,2690523532.00,Canada,,71628,,
DOV,Dover Corporation Common Stock,$158.80,-2.86,-1.769%,22860996160.00,United States,,360547,Capital Goods,Industrial Machinery/Components
DOW,Dow Inc. Common Stock ,$59.525,-0.165,-0.276%,44392065681.00,,2019,3716457,Basic Industries,Industrial Specialties
DPG,Duff & Phelps Utility and Infrastructure Fund Inc.,$13.2246,-0.2154,-1.603%,501606512.00,United States,2011,81913,Finance,Trusts Except Educational Religious and Charitable
DPZ,Domino's Pizza Inc Common Stock,$484.46,-2.77,-0.569%,17854391061.00,United States,2004,180485,Consumer Non-Durables,Food Distributors
DQ,DAQO New Energy Corp. American Depositary Shares each representing five ordinary shares,$52.19,-2.02,-3.726%,3836673740.00,China,2010,911855,Technology,Semiconductors
DRD,DRDGOLD Limited American Depositary Shares,$8.22,-0.25,-2.952%,702903535.00,South Africa,,133958,Basic Industries,Precious Metals
DRE,Duke Realty Corporation Common Stock,$47.95,-0.12,-0.25%,18141422707.00,United States,,701202,Consumer Services,Real Estate Investment Trusts
DRH,Diamondrock Hospitality Company Common Stock,$9.605,-0.015,-0.156%,2023003563.00,United States,2005,786169,Consumer Services,Real Estate Investment Trusts
DRH^A,Diamondrock Hospitality Company 8.250% Series A Cumulative Redeemable Preferred Stock,$26.54,-0.35,-1.302%,,United States,,15185,,
DRI,Darden Restaurants Inc. Common Stock,$157.95,-1.86,-1.164%,20653972098.00,United States,,587044,Consumer Services,Restaurants
DRQ,Dril-Quip Inc. Common Stock,$25.07,-0.11,-0.437%,888257928.00,United States,1997,148043,Energy,Metal Fabrications
DS,Drive Shack Inc.,$2.855,-0.095,-3.22%,262903871.00,United States,,704953,Consumer Services,Movies/Entertainment
DS^B,Drive Shack Inc. Preferred Series B,$25.75,-0.39,-1.492%,,United States,,1792,,
DS^C,Drive Shack Inc. Preferred Series C,$25.6266,0.00,0.00%,,United States,,8,,
DS^D,Drive Shack Inc. Pfd Ser D,$26.265,-0.035,-0.133%,,United States,,1600,,
DSL,DoubleLine Income Solutions Fund Common Shares of Beneficial Interests,$17.48,-0.26,-1.466%,1782904553.00,,2013,267127,Finance,Trusts Except Educational Religious and Charitable
DSM,BNY Mellon Strategic Municipal Bond Fund Inc. Common Stock,$8.19,-0.08,-0.967%,404762175.00,United States,1989,67093,Finance,Investment Managers
DSU,Blackrock Debt Strategies Fund Inc. Common Stock,$11.335,-0.105,-0.918%,528118132.00,United States,1998,61951,Finance,Finance Companies
DSX,Diana Shipping inc. common stock,$5.56,0.11,2.018%,508934611.00,Greece,2005,737200,Transportation,Marine Transportation
DSX^B,Diana Shipping Inc. Perpetual Preferred Shares Series B (Marshall Islands),$26.18,-0.07,-0.267%,,Greece,,526,,
DT,Dynatrace Inc. Common Stock,$68.768,-3.922,-5.396%,19549803510.00,United States,2019,1414054,Technology,EDP Services
DTB,DTE Energy Company 2020 Series G 4.375% Junior Subordinated Debentures due 2080,$25.35,-0.18,-0.705%,0.00,United States,2020,36144,Public Utilities,Electric Utilities: Central
DTE,DTE Energy Company Common Stock,$110.82,-1.78,-1.581%,21471547214.00,United States,,336739,Public Utilities,Electric Utilities: Central
DTF,DTF Tax-Free Income Inc. Common Stock,$14.47,-0.1292,-0.885%,101717834.00,United States,1991,2414,Finance,Investment Managers
DTLA^,Brookfield DTLA Inc. 7.625% Series A Cumulative Redeemable Preferred Stock,$13.60,-0.27,-1.947%,,,,466,,
DTM,DT Midstream Inc. Common Stock ,$46.00,-0.20,-0.433%,4449693436.00,,2021,89606,Public Utilities,Oil & Gas Production
DTP,DTE Energy Company 6.25% Corporate Units,$49.56,-0.56,-1.117%,0.00,United States,,108662,Public Utilities,Electric Utilities: Central
DTW,DTE Energy Company 2017 Series E 5.25% Junior Subordinated Debentures due 2077,$25.80,-0.17,-0.655%,0.00,United States,2017,13959,Public Utilities,Electric Utilities: Central
DTY,DTE Energy Company 2016 Series F 6.00% Junior Subordinated Debentures due 2076,$25.3699,-0.0601,-0.236%,0.00,United States,2016,3013,,
DUK,Duke Energy Corporation (Holding Company) Common Stock,$96.74,-0.89,-0.912%,74425719231.00,United States,,1164800,Public Utilities,Power Generation
DUK^A,Duke Energy Corporation Depositary Shares each representing a 1/1000th interest in a share of 5.75% Series A Cumulative Redeemable Perpetual Preferred Stock,$27.38,-0.16,-0.581%,,United States,,41599,,
DUKB,Duke Energy Corporation 5.625% Junior Subordinated Debentures due 2078,$26.6595,-0.0905,-0.338%,0.00,United States,2018,20661,Public Utilities,Power Generation
DUKH,Duke Energy Corporation 5.125% Junior Subordinated Debentures due 2073,$25.28,-0.01,-0.04%,0.00,United States,,34160,Public Utilities,Power Generation
DV,DoubleVerify Holdings Inc. Common Stock,$35.05,-0.67,-1.876%,5532684700.00,,2021,527989,Technology,Computer Software: Prepackaged Software
DVA,DaVita Inc. Common Stock,$121.28,0.60,0.497%,12702310040.00,United States,,310257,Health Care,Medical/Nursing Services
DVD,Dover Motorsports Inc. Common Stock,$2.35,-0.06,-2.49%,85647139.00,United States,1996,5098,Consumer Services,Services-Misc. Amusement & Recreation
DVN,Devon Energy Corporation Common Stock,$35.2999,0.2999,0.857%,23898032300.00,United States,,10275620,Energy,Oil & Gas Production
DWIN,Delwinds Insurance Acquisition Corp. Class A Common Stock,$9.86,0.01,0.102%,254277075.00,,2021,283100,,
DX,Dynex Capital Inc. Common Stock,$17.54,-0.01,-0.057%,606735524.00,United States,,240414,Consumer Services,Real Estate Investment Trusts
DX^C,Dynex Capital Inc. 6.900% Series C Fixed-to-Floating Rate Cumulative Redeemable Preferred Stock,$25.8794,-0.1006,-0.387%,,United States,,2695,,
DXC,DXC Technology Company Common Stock ,$34.87,-0.64,-1.802%,8783900919.00,,,433051,Technology,EDP Services
DY,Dycom Industries Inc. Common Stock,$72.19,0.69,0.965%,2178015614.00,United States,,157542,Basic Industries,Water Supply
DYFN,Angel Oak Dynamic Financial Strategies Income Term Trust Common Shares of Beneficial Interest,$20.54,-0.06,-0.291%,83289700.00,,2020,9066,Finance,Finance/Investors Services
E,ENI S.p.A. Common Stock,$26.37,0.12,0.457%,47104067135.00,Italy,,174682,Energy,Oil & Gas Production
