Symbol,Name,Last Sale,Net Change,% Change,Market Cap,Country,IPO Year,Volume,Sector,Industry
IBA,Industrias Bachoco S.A.B. de C.V. Common Stock,$45.48,-0.53,-1.152%,2274000000.00,Mexico,1997,4770,Consumer Non-Durables,Meat/Poultry/Fish
IBER,Ibere Pharmaceuticals Class A Ordinary Shares,$9.68,0.00,0.00%,166980000.00,,2021,160,,
IBM,International Business Machines Corporation Common Stock,$137.77,-0.79,-0.57%,123486016457.00,United States,,2245548,Technology,EDP Services
IBN,ICICI Bank Limited Common Stock,$19.065,-0.785,-3.955%,66091438599.00,India,,3249219,Finance,Commercial Banks
IBP,Installed Building Products Inc. Common Stock,$111.36,-2.73,-2.393%,3307545900.00,,2014,30953,Capital Goods,Homebuilding
ICD,Independence Contract Drilling Inc. Common Stock,$3.15,0.05,1.613%,22818402.00,,2014,79464,Energy,Oil & Gas Production
ICE,Intercontinental Exchange Inc. Common Stock,$116.795,-1.845,-1.555%,65773711117.00,United States,2005,1283486,Finance,Investment Bankers/Brokers/Service
ICL,ICL Group Ltd. Ordinary Shares,$7.315,-0.105,-1.415%,9393565640.00,Israel,2014,82983,Basic Industries,Agricultural Chemicals
ICR^A,InPoint Commercial Real Estate Income Inc. 6.75% Series A Cumulative Redeemable Preferred Stock,$24.80,0.08,0.324%,,,,7058,,
IDA,IDACORP Inc. Common Stock,$104.51,0.65,0.626%,5279467292.00,United States,,168087,Public Utilities,Electric Utilities: Central
IDE,Voya Infrastructure Industrials and Materials Fund Common Shares of Beneficial Interest,$12.68,0.05,0.396%,241418185.00,United States,2010,21735,Finance,Finance/Investors Services
IDT,IDT Corporation Class B Common Stock,$42.44,-1.73,-3.917%,1093304564.00,United States,,73371,Public Utilities,Telecommunications Equipment
IEX,IDEX Corporation Common Stock,$212.345,-3.055,-1.418%,16137823977.00,United States,1989,99104,Capital Goods,Fluid Controls
IFF,Internationa Flavors & Fragrances Inc. Common Stock,$132.97,1.38,1.049%,33844154944.00,United States,,723854,Basic Industries,Major Chemicals
IFN,India Fund Inc. (The) Common Stock,$23.26,-0.20,-0.853%,625800415.00,United States,,69295,Finance,Finance/Investors Services
IFS,Intercorp Financial Services Inc. Common Shares,$22.345,-0.615,-2.679%,2579018137.00,,2019,22213,Finance,Commercial Banks
IGA,Voya Global Advantage and Premium Opportunity Fund Common Shares of Beneficial Interest,$9.89,-0.15,-1.494%,179990602.00,United States,2005,37077,Finance,Investment Managers
IGD,Voya Global Equity Dividend and Premium Opportunity Fund,$5.91,-0.11,-1.827%,561313266.00,United States,2005,192639,Finance,Trusts Except Educational Religious and Charitable
IGI,Western Asset Investment Grade Defined Opportunity Trust Inc. Common Stock,$22.3607,-0.0893,-0.398%,242475764.00,United States,2009,15462,Finance,Investment Managers
IGR,CBRE Clarion Global Real Estate Income Fund Common Stock,$8.36,-0.20,-2.336%,974696530.00,United States,2004,484361,Finance,Finance Companies
IGT,International Game Technology Ordinary Shares,$26.47,0.40,1.534%,5431326360.00,United States,2015,1578895,Consumer Services,Movies/Entertainment
IH,iHuman Inc. American depositary shares each representing five Class A ordinary shares,$4.64,-0.43,-8.481%,247425569.00,United States,2020,11146,Consumer Services,Other Consumer Services
IHC,Independence Holding Company Common Stock,$49.50,0.32,0.651%,724897256.00,United States,,12788,Finance,Life Insurance
IHD,Voya Emerging Markets High Income Dividend Equity Fund Common Shares,$7.37,-0.03,-0.405%,136546326.00,United States,2011,34311,Finance,Investment Managers
IHG,Intercontinental Hotels Group American Depositary Shares (Each representing one Ordinary Share),$65.35,-1.73,-2.579%,11973185989.00,United Kingdom,,103304,Consumer Services,Hotels/Resorts
IHIT,Invesco High Income 2023 Target Term Fund Common Shares of Beneficial Interest,$9.7463,-0.0937,-0.952%,234661558.00,United States,2016,36270,Finance,Investment Managers
IHTA,Invesco High Income 2024 Target Term Fund Common Shares of Beneficial Interest No par value per share,$9.83,-0.02,-0.203%,86325182.00,,2017,7276,Finance,Finance/Investors Services
IIAC,Investindustrial Acquisition Corp. Class A Ordinary Shares,$9.99,0.04,0.402%,502621875.00,United Kingdom,2021,4267,Finance,Business Services
IIF,Morgan Stanley India Investment Fund Inc. Common Stock,$27.76,-0.41,-1.455%,310960941.00,United States,1994,9003,Finance,Trusts Except Educational Religious and Charitable
IIIN,Insteel Industries Inc. Common Stock,$38.63,-0.97,-2.449%,747782968.00,United States,,30945,,
IIM,Invesco Value Municipal Income Trust Common Stock,$16.46,-0.26,-1.555%,774550286.00,United States,,110057,Finance,Investment Managers
IIPR,Innovative Industrial Properties Inc. Common Stock,$235.015,-6.515,-2.697%,5623510365.00,United States,2016,135674,Consumer Services,Real Estate Investment Trusts
IIPR^A,Innovative Industrial Properties Inc. 9.00% Series A Cumulative Redeemable Preferred Stock,$36.4999,0.8999,2.528%,,United States,,847,,
IMAX,Imax Corporation Common Stock,$18.235,-0.265,-1.432%,1083084401.00,Canada,,546627,,
IMPX,AEA-Bridges Impact Corp. Class A Ordinary Shares,$9.77,0.00,0.00%,488500000.00,,2020,20639,Finance,Business Services
INFO,IHS Markit Ltd. Common Shares,$115.53,-7.13,-5.813%,46051678095.00,Bermuda,1996,1858577,Miscellaneous,Business Services
INFY,Infosys Limited American Depositary Shares,$22.17,-0.73,-3.188%,92802057436.00,India,,4281437,Technology,EDP Services
ING,ING Group N.V. Common Stock,$14.45,-0.13,-0.892%,56403449044.00,Netherlands,1997,2994747,Finance,Commercial Banks
INGR,Ingredion Incorporated Common Stock,$89.265,-0.725,-0.806%,5981207395.00,United States,,129761,Consumer Non-Durables,Farming/Seeds/Milling
INN,Summit Hotel Properties Inc. Common Stock,$10.00,0.09,0.908%,1064457600.00,United States,2011,706978,Consumer Services,Real Estate Investment Trusts
INN^E,Summit Hotel Properties Inc. 6.250% Series E Cumulative Redeemable Preferred Stock,$25.70,-0.30,-1.154%,,United States,,2388,,
INN^F,Summit Hotel Properties Inc. 5.875% Series F Cumulative Redeemable Preferred Stock $0.01 par value per share,$25.82,-0.28,-1.073%,,United States,,2734,,
INS,Intelligent Systems Corporation Common Stock,$39.0842,-0.0258,-0.066%,341697488.00,United States,1992,14294,Technology,Retail: Computer Software & Peripheral Equipment
INSI,Insight Select Income Fund,$21.03,-0.14,-0.661%,225232036.00,United States,,5846,Finance,Investment Managers
INSP,Inspire Medical Systems Inc. Common Stock,$228.01,-11.87,-4.948%,6218197060.00,United States,1998,127694,Health Care,Biotechnology: Electromedical & Electrotherapeutic Apparatus
INST,Instructure Holdings Inc. Common Stock,$22.64,-0.46,-1.991%,3135640000.00,,2021,58682,Technology,Computer Software: Prepackaged Software
INSW,International Seaways Inc. Common Stock ,$18.38,0.03,0.163%,931395343.00,,2016,172796,Transportation,Marine Transportation
INSW^A,International Seaways Inc. 8.50% Senior Notes due June 30 2023,$26.00,0.03,0.116%,,,,708,,
INT,World Fuel Services Corporation Common Stock,$34.355,-0.325,-0.937%,2181619936.00,United States,,102191,Energy,Oil Refining/Marketing
INVH,Invitation Homes Inc. Common Stock,$38.54,-0.02,-0.052%,22217745081.00,United States,2017,1561593,Consumer Services,Real Estate Investment Trusts
IO,Ion Geophysical Corporation Common Stock,$1.41,0.03,2.174%,41788844.00,United States,,446976,Energy,Oilfield Services/Equipment
IP,International Paper Company Common Stock,$57.41,0.08,0.14%,22437815190.00,United States,,686142,Basic Industries,Containers/Packaging
IPG,Interpublic Group of Companies Inc. (The) Common Stock,$37.91,-0.81,-2.092%,14922142730.00,United States,,1519986,Technology,Advertising
IPI,Intrepid Potash Inc Common Stock,$31.73,-0.53,-1.643%,426894151.00,United States,2008,49437,Basic Industries,Major Chemicals
IPOD,Social Capital Hedosophia Holdings Corp. IV Class A Ordinary Shares,$10.11,0.01,0.099%,581325000.00,United States,2020,416359,Finance,Business Services
IPOF,Social Capital Hedosophia Holdings Corp. VI Class A Ordinary Shares,$10.4885,0.2585,2.527%,1507721875.00,United States,2020,2838488,Finance,Business Services
IPVA,InterPrivate II Acquisition Corp. Class A Common Stock,$9.73,-0.04,-0.409%,316650688.00,,2021,3704,,
IPVF,InterPrivate III Financial Partners Inc. Class A Common Stock,$9.875,-0.025,-0.253%,328207969.00,,2021,3486,,
IQI,Invesco Quality Municipal Income Trust Common Stock,$13.25,-0.18,-1.34%,700710310.00,United States,,71941,Finance,Finance Companies
IQV,IQVIA Holdings Inc. Common Stock,$242.59,-5.55,-2.237%,46483236833.00,United States,2013,808855,Health Care,Managed Health Care
IR,Ingersoll Rand Inc. Common Stock,$51.86,-1.52,-2.848%,21016808908.00,United States,2017,1140177,Capital Goods,Industrial Machinery/Components
IRL,New Ireland Fund Inc (The) Common Stock,$12.755,-0.045,-0.352%,61902592.00,United States,1990,1094,Finance,Trusts Except Educational Religious and Charitable
IRM,Iron Mountain Incorporated (Delaware)Common Stock REIT,$43.75,-0.29,-0.658%,12663888738.00,United States,,512369,Consumer Services,Real Estate Investment Trusts
IRNT,IronNet Inc. Common Stock,$25.30,-0.53,-2.052%,2135916245.00,United States,2020,3272396,Technology,EDP Services
IRS,IRSA Inversiones Y Representaciones S.A. Common Stock,$4.02,-0.10,-2.427%,264787937.00,Argentina,,20590,Consumer Services,Homebuilding
IRT,Independence Realty Trust Inc. Common Stock,$20.66,0.04,0.194%,2171603177.00,United States,2013,306081,Consumer Services,Real Estate Investment Trusts
IS,ironSource Ltd. Class A Ordinary Shares,$11.50,-0.02,-0.174%,11649095108.00,,2021,905881,,
ISD,PGIM High Yield Bond Fund Inc.,$16.2655,-0.1345,-0.82%,540937244.00,United States,2012,74098,Finance,Trusts Except Educational Religious and Charitable
ISOS,Isos Acquisition Corporation Class A Ordinary Shares,$9.95,0.04,0.404%,316953519.00,,2021,3737,,
IT,Gartner Inc. Common Stock,$306.95,-8.16,-2.59%,25675983199.00,United States,1993,287254,Finance,Diversified Commercial Services
ITCB,Itau CorpBanca American Depositary Shares (each representing 1500 shares of Common Stock no par value),$3.982,-0.048,-1.191%,1360269143.00,Chile,,1844,Finance,Commercial Banks
ITGR,Integer Holdings Corporation Common Stock,$89.50,-2.15,-2.346%,2953505191.00,United States,,37586,Health Care,Medical/Dental Instruments
ITT,ITT Inc. Common Stock ,$86.60,-0.15,-0.173%,7456260000.00,United States,2011,227720,Capital Goods,Fluid Controls
ITUB,Itau Unibanco Banco Holding SA American Depositary Shares (Each repstg 500 Preferred shares),$5.235,-0.165,-3.056%,51197709235.00,Brazil,,24433314,Finance,Commercial Banks
ITW,Illinois Tool Works Inc. Common Stock,$214.82,-1.74,-0.803%,67661385803.00,United States,,438426,Capital Goods,Industrial Machinery/Components
IVAN,Ivanhoe Capital Acquisition Corp. Class A Ordinary Shares,$9.895,-0.005,-0.051%,341377500.00,,2021,151032,Finance,Business Services
IVC,Invacare Corporation Common Stock,$5.18,-0.09,-1.708%,181341621.00,United States,,257184,Health Care,Industrial Specialties
IVH,Delaware Ivy High Income Opportunities Fund,$13.77,-0.12,-0.864%,228172122.00,,2013,11407,Finance,Investment Managers
IVR,INVESCO MORTGAGE CAPITAL INC Common Stock,$3.1257,-0.0543,-1.708%,905455152.00,United States,2009,2220821,Consumer Services,Real Estate Investment Trusts
IVR^B,Invesco Mortgage Capital Inc. Preferred Series B Cum Fxd to Fltg,$25.45,-0.1184,-0.463%,,United States,,17583,,
IVR^C,INVESCO MORTGAGE CAPITAL INC 7.5% Fixed-to-Floating Series C Cumulative Redeemable Preferred Stock Liquation Preference $25.00 per Share,$25.16,-0.5999,-2.329%,,United States,,11392,,
IVZ,Invesco Ltd Common Stock,$25.10,-0.46,-1.80%,11580933778.00,United States,,2273842,Finance,Investment Managers
IX,Orix Corp Ads Common Stock,$96.42,-2.44,-2.468%,23265538168.00,Japan,,4996,Finance,Diversified Financial Services
J,Jacobs Engineering Group Inc. Common Stock,$136.71,-1.56,-1.128%,17815283265.00,United States,,316724,Capital Goods,Oilfield Services/Equipment
JAX,J. Alexander's Holdings Inc. Common Stock,$13.995,0.015,0.107%,211043103.00,,2015,115867,Consumer Services,Restaurants
JBGS,JBG SMITH Properties Common Shares ,$29.97,-0.01,-0.033%,3954268863.00,United States,2017,230647,Consumer Services,Real Estate Investment Trusts
JBI,Janus International Group Inc. Common Stock,$12.94,-0.07,-0.538%,1790692195.00,,2021,218650,,
JBK,Lehman ABS 3.50 3.50% Adjustable Corp Backed Tr Certs GS Cap I,$33.4945,0.0445,0.133%,0.00,United States,,501,Finance,Trusts Except Educational Religious and Charitable
JBL,Jabil Inc. Common Stock,$61.525,-0.835,-1.339%,8972167986.00,United States,1993,588142,Technology,Electrical Products
JBT,John Bean Technologies Corporation Common Stock,$153.28,-2.74,-1.756%,4869269365.00,United States,,47044,Capital Goods,Diversified Manufacture
JCE,Nuveen Core Equity Alpha Fund Nuveen Core Equity Alpha Fund Common Shares of Beneficial Interest,$16.90,-0.16,-0.938%,270894849.00,United States,2007,24188,Finance,Trusts Except Educational Religious and Charitable
JCI,Johnson Controls International plc Ordinary Share,$70.86,-1.06,-1.474%,50468209930.00,Switzerland,,3506121,Capital Goods,Industrial Machinery/Components
JCO,Nuveen Credit Opportunities 2022 Target Term Fund Common Shares of Beneficial Interest,$8.19,-0.01,-0.122%,227388945.00,United States,2017,15533,Finance,Trusts Except Educational Religious and Charitable
JDD,Nuveen Diversified Dividend and Income Fund Shares of Beneficial Interest,$10.23,-0.135,-1.302%,201208929.00,United States,2003,34482,Finance,Finance Companies
JEF,Jefferies Financial Group Inc. Common Stock,$37.71,-0.14,-0.37%,9315781108.00,United States,,1060110,Finance,Finance/Investors Services
JELD,JELD-WEN Holding Inc. Common Stock,$26.11,-0.43,-1.62%,2405166280.00,United States,2017,481265,,
JEMD,Nuveen Emerging Markets Debt 2022 Target Term Fund Common Shares of Beneficial Interest $0.01 par value per share,$8.005,0.065,0.819%,114059130.00,,2017,18249,Finance,Investment Managers
JEQ,Aberdeen Japan Equity Fund Inc.  Common Stock,$9.81,-0.27,-2.679%,131537738.00,United States,1992,5980,Finance,Finance Companies
JFR,Nuveen Floating Rate Income Fund Common Stock,$9.965,0.055,0.555%,567192534.00,United States,2004,126846,Finance,Trusts Except Educational Religious and Charitable
JGH,Nuveen Global High Income Fund Common Shares of Beneficial Interest,$15.90,-0.16,-0.996%,368520549.00,United States,2014,18216,Finance,Investment Managers
JHAA,Nuveen Corporate Income 2023 Target Term Fund,$9.91,-0.01,-0.101%,77553757.00,,2018,21197,Finance,Finance/Investors Services
JHB,Nuveen Corporate Income November 2021 Target Term Fund,$9.38,0.005,0.053%,524342460.00,,2016,44393,Finance,Investment Managers
JHG,Janus Henderson Group plc Ordinary Shares,$41.50,-0.92,-2.169%,7152524544.00,,2017,226754,Finance,Investment Managers
JHI,John Hancock Investors Trust Common Stock,$18.70,-0.03,-0.16%,162821368.00,United States,,24515,Finance,Trusts Except Educational Religious and Charitable
JHS,John Hancock Income Securities Trust Common Stock,$15.93,-0.0706,-0.441%,185530099.00,United States,,3948,Finance,Finance Companies
JHX,James Hardie Industries plc American Depositary Shares (Ireland),$36.55,-1.94,-5.04%,16250089137.00,Ireland,,35015,Capital Goods,Building Materials
JILL,J. Jill Inc. Common Stock,$17.34,0.34,2.00%,173132895.00,,2017,15713,Consumer Services,Clothing/Shoe/Accessory Stores
JKS,JinkoSolar Holding Company Limited American Depositary Shares (each representing 4 Common Shares),$42.62,-1.42,-3.224%,2032425395.00,China,2010,786624,Technology,Semiconductors
JLL,Jones Lang LaSalle Incorporated Common Stock,$248.98,0.31,0.125%,12623702046.00,United States,,99782,Finance,Real Estate
JLS,Nuveen Mortgage and Income Fund,$21.05,-0.15,-0.708%,115510612.00,United States,2009,6371,Finance,Investment Managers
JMIA,Jumia Technologies AG American Depositary Shares each representing two Ordinary Shares,$19.08,-1.54,-7.468%,1881146503.00,,2019,4891382,Consumer Services,Catalog/Specialty Distribution
JMM,Nuveen Multi-Market Income Fund (MA),$7.40,-0.02,-0.27%,70021390.00,United States,,8009,Finance,Trusts Except Educational Religious and Charitable
JMP,JMP Group LLC Common Shares,$7.46,0.00,0.00%,148410560.00,United States,2007,9759,Finance,Investment Bankers/Brokers/Service
JNJ,Johnson & Johnson Common Stock,$162.65,-0.52,-0.319%,428173212264.00,United States,,3322833,Health Care,Biotechnology: Pharmaceutical Preparations
JNPR,Juniper Networks Inc. Common Stock,$28.425,-0.235,-0.82%,9242440512.00,United States,1999,931975,Technology,Computer peripheral equipment
JOBY,Joby Aviation Inc. Common Stock,$10.055,-0.005,-0.05%,6072093277.00,United States,2020,1973810,Transportation,Aerospace
JOE,St. Joe Company (The) Common Stock,$42.91,-0.46,-1.061%,2526650178.00,United States,,29847,Consumer Services,Homebuilding
JOF,Japan Smaller Capitalization Fund Inc Common Stock,$9.12,-0.16,-1.724%,258405104.00,United States,1990,19908,Finance,Trusts Except Educational Religious and Charitable
JP,Jupai Holdings Limited American Depositary Shares each representing six ordinary shares,$1.09,0.00,0.00%,36215440.00,,2015,30903,Consumer Services,Other Consumer Services
JPC,Nuveen Preferred & Income Opportunities Fund,$9.82,-0.10,-1.008%,1014947563.00,United States,2003,388125,Finance,Investment Managers
JPI,Nuveen Preferred and Income Term Fund Common Shares of Beneficial Interest,$25.04,-0.21,-0.832%,569945231.00,,2012,31092,Finance,Finance Companies
JPM,JP Morgan Chase & Co. Common Stock,$166.58,-0.40,-0.24%,497766919036.00,United States,,7338154,Finance,Major Banks
JPM^C,J P Morgan Chase & Co Depositary Shares each representing a 1/400th interest in a share of 6.00% Non-Cumulative  Preferred Stock Series EE,$27.47,-0.27,-0.973%,,United States,,88678,,
JPM^D,J P Morgan Chase & Co Depositary Shares each representing a 1/400th  interest in a share of 5.75% Non-Cumulative  Preferred Stock Series DD,$26.99,-0.29,-1.063%,,United States,,85465,,
JPM^J,J P Morgan Chase & Co Depositary Shares each representing a 1/400th interest in a share of JPMorgan Chase & Co. 4.75% Non-Cumulative Preferred Stock Series GG,$26.10,-0.26,-0.986%,,United States,,49531,,
JPM^K,J P Morgan Chase & Co Depositary Shares each representing a 1/400th interest in a share of 4.55% Non-Cumulative Preferred Stock Series JJ,$25.78,-0.41,-1.565%,,United States,,294637,,
JPM^L,J P Morgan Chase & Co Depositary Shares each representing a 1/400th interest in a share of 4.625% Non-Cumulative Preferred Stock Series LL,$25.97,-0.39,-1.48%,,United States,,202140,,
JPM^M,J P Morgan Chase & Co Depositary Shares each representing a 1/400th interest in a share of 4.20% Non-Cumulative Preferred Stock Series MM,$25.07,-0.32,-1.26%,,United States,,332695,,
JPS,Nuveen Preferred & Income Securities Fund,$9.79,-0.13,-1.31%,1995105539.00,United States,2002,427904,Finance,Investment Managers
JPT,Nuveen Preferred and Income 2022 Term Fund Common Shares of Beneficial Interest,$24.90,-0.13,-0.519%,170342693.00,United States,2017,23612,Finance,Trusts Except Educational Religious and Charitable
JQC,Nuveen Credit Strategies Income Fund Shares of Beneficial Interest,$6.435,0.005,0.078%,872645781.00,United States,2003,460352,Finance,Finance Companies
JRI,Nuveen Real Asset Income and Growth Fund Common Shares of Beneficial Interest,$15.40,-0.31,-1.973%,422786672.00,United States,2012,43541,Finance,Finance Companies
JRO,Nuveen Floating Rate Income Opportuntiy Fund Shares of Beneficial Interest,$9.89,-0.01,-0.101%,400952646.00,United States,2004,64510,Finance,Investment Managers
JRS,Nuveen Real Estate Income Fund Common Shares of Beneficial Interest,$10.4849,-0.2051,-1.919%,302934669.00,United States,2001,168689,Finance,Finance/Investors Services
JSD,Nuveen Short Duration Credit Opportunities Fund Common Shares of Beneficial Interest,$14.9746,-0.0554,-0.369%,151028545.00,United States,2011,18410,Finance,Finance Companies
JT,Jianpu Technology Inc. American depositary shares,$1.48,-0.01,-0.671%,31348434.00,,2017,113032,Technology,EDP Services
JTA,Nuveen Tax-Advantaged Total Return Strategy Fund Common Share of Beneficial Interest,$11.14,-0.1524,-1.35%,154298993.00,United States,2004,8634,Finance,Finance Companies
JTD,Nuveen Tax-Advantaged Dividend Growth Fund Common Shares of Beneficial Interest,$15.8078,-0.1422,-0.892%,228965550.00,United States,,18900,Finance,Trusts Except Educational Religious and Charitable
JW/A,John Wiley & Sons Inc.,$54.2275,-1.1725,-2.116%,,United States,,76982,,
JW/B,John Wiley & Sons Inc.,$55.00,0.00,0.00%,,United States,,5,,
JWN,Nordstrom Inc. Common Stock,$29.54,-0.28,-0.939%,4694581550.00,United States,,1449605,Consumer Services,Clothing/Shoe/Accessory Stores
JWSM,Jaws Mustang Acquisition Corp. Class A Ordinary Shares,$9.76,-0.01,-0.102%,1262700000.00,,2021,44683,Finance,Business Services
JXN,Jackson Financial Inc. Class A Common Stock ,$26.675,-0.785,-2.859%,2519836350.00,,2021,3096821,Finance,Finance/Investors Services
K,Kellogg Company Common Stock,$63.71,-0.29,-0.453%,21717398159.00,United States,,619125,Consumer Non-Durables,Packaged Foods
KAHC,KKR Acquisition Holdings I Corp. Class A Common Stock,$9.77,0.02,0.205%,1685325000.00,,2021,48878,,
KAI,Kadant Inc Common Stock,$211.84,-10.16,-4.577%,2453171811.00,United States,,16781,Technology,Industrial Machinery/Components
KAMN,Kaman Corporation Common Stock,$35.36,-0.87,-2.401%,984306631.00,United States,,33900,Capital Goods,Military/Government/Technical
KAR,KAR Auction Services Inc Common Stock,$16.07,0.13,0.816%,1915290464.00,United States,2009,1088058,,
KB,KB Financial Group Inc,$46.58,1.09,2.396%,18149167324.00,South Korea,,430725,Finance,Commercial Banks
KBH,KB Home Common Stock,$40.31,-1.14,-2.75%,3984576666.00,United States,1986,543729,,
KBR,KBR Inc. Common Stock,$38.88,-1.36,-3.38%,5473671539.00,United States,2006,720462,Capital Goods,Oilfield Services/Equipment
KCAC,Kensington Capital Acquisition Corp. II Class A Common Stock,$9.95,-0.04,-0.40%,286062500.00,,2021,175574,,
KEN,Kenon Holdings Ltd. Ordinary Shares,$42.50,-0.90,-2.074%,2289862473.00,Singapore,2015,1396,Public Utilities,Electric Utilities: Central
KEP,Korea Electric Power Corporation Common Stock,$9.87,-0.30,-2.95%,12672370880.00,South Korea,1994,124760,Consumer Durables,Electrical Products
KEX,Kirby Corporation Common Stock,$51.215,-0.285,-0.553%,3078482435.00,United States,,156422,Transportation,Marine Transportation
KEY,KeyCorp Common Stock,$21.95,0.13,0.596%,20992323739.00,United States,,4348167,Finance,Major Banks
KEY^I,KeyCorp Depositary Shares Each Representing a 1/40th Ownership Interest in a Share of Fixed-to-Floating Rate Perpetual Non-Cumulative Preferred Stock Series E,$30.01,-0.36,-1.185%,,United States,,23347,,
KEY^J,KeyCorp Depositary Shares each representing a 1/40th ownership interest in a share of Fixed Rate Perpetual Non-Cumulative Preferred Stock Series F,$26.651,-0.249,-0.926%,,United States,,10995,,
KEY^K,KeyCorp Depositary Shares each representing a 1/40th ownership interest in a share of Fixed Rate Perpetual Non-Cumulative Preferred Stock Series G,$27.09,-0.35,-1.276%,,United States,,15902,,
KEYS,Keysight Technologies Inc. Common Stock,$169.75,-7.08,-4.004%,31267245368.00,United States,2014,469337,Capital Goods,Industrial Machinery/Components
KF,Korea Fund Inc. (The) New Common Stock,$40.80,-1.20,-2.857%,205670719.00,United States,,1829,Finance,Investment Managers
KFS,Kingsway Financial Services Inc. Common Stock (DE),$5.28,-0.05,-0.938%,119938532.00,Canada,,5164,,
KFY,Korn Ferry Common Stock,$73.65,-1.74,-2.308%,4014367637.00,United States,1999,102177,Technology,Diversified Commercial Services
KGC,Kinross Gold Corporation Common Stock,$5.305,0.025,0.473%,6694557424.00,Canada,,7083658,,
KIM,Kimco Realty Corporation Common Stock,$21.35,-0.18,-0.836%,13085207820.00,United States,,6787379,Consumer Services,Real Estate Investment Trusts
KIM^L,Kimco Realty Corporation Class L Depositary Shares each of which represents a one-one thousandth fractional interest in a share of 5.125% Class L Cumulative Redeemable Preferred Stock liquidation preference $25000.00 per share,$26.00,-0.17,-0.65%,,United States,,6570,,
KIM^M,Kimco Realty Corporation Class M Depositary Shares each of which represents a one-one thousandth fractional interest in a share of 5.25% Class M Cumulative Redeemable Preferred Stock liquidation preference $25000.00 per share,$26.34,-0.28,-1.052%,,United States,,3748,,
KIO,KKR Income Opportunities Fund Common Shares,$16.20,-0.07,-0.43%,329513103.00,,2013,45595,Finance,Investment Managers
KKR,KKR & Co. Inc. Common Stock,$60.02,-1.51,-2.454%,34993518999.00,United States,,1131618,Finance,Investment Managers
KKR^C,KKR & Co. Inc. 6.00% Series C Mandatory Convertible Preferred Stock,$77.7411,-1.5389,-1.941%,,United States,,40343,,
KKRS,KKR Group Finance Co. IX LLC 4.625% Subordinated Notes due 2061,$25.5208,-0.3792,-1.464%,0.00,,2021,108971,,
KL,Kirkland Lake Gold Ltd. Common Shares,$40.765,-3.325,-7.541%,10836952232.00,,,5434700,,
KLR,Kaleyra Inc. Common Stock,$11.18,-0.66,-5.574%,461816016.00,United States,2018,50790,Technology,Internet and Information Services
KMB,Kimberly-Clark Corporation Common Stock,$132.29,-0.14,-0.106%,44550256489.00,United States,,622120,Basic Industries,Paper
KMF,Kayne Anderson NextGen Energy & Infrastructure Inc.,$7.24,-0.13,-1.764%,341709625.00,,2010,132550,Finance,Investment Managers
KMI,Kinder Morgan Inc. Common Stock,$16.957,-0.023,-0.135%,38400526860.00,United States,2011,6968085,Public Utilities,Natural Gas Distribution
KMPR,Kemper Corporation,$67.50,-0.71,-1.041%,4294813725.00,United States,,46706,Finance,Property-Casualty Insurers
KMT,Kennametal Inc. Common Stock,$35.37,-0.51,-1.421%,2965513646.00,United States,,168223,Capital Goods,Industrial Machinery/Components
