Symbol,Name,Last Sale,Net Change,% Change,Market Cap,Country,IPO Year,Volume,Sector,Industry
QUOT,Quotient Technology Inc. Common Stock,$5.96,-0.16,-2.614%,560913552.00,,2014,429938,Technology,Advertising
QVCC,QVC Inc. 6.250% Senior Secured Notes due 2068,$25.71,-0.23,-0.887%,0.00,United States,2019,37361,,
QVCD,QVC Inc. 6.375% Senior Secured Notes due 2067,$26.05,-0.28,-1.063%,0.00,United States,2018,4707,,
R,Ryder System Inc. Common Stock,$85.13,-0.04,-0.047%,4577746483.00,United States,,127165,Miscellaneous,Rental/Leasing Companies
RA,Brookfield Real Assets Income Fund Inc. Common Stock,$21.22,-0.29,-1.348%,973205178.00,,2016,279517,Finance,Investment Managers
RAAS,Cloopen Group Holding Limited American Depositary Shares each representing two Class A Ordinary Shares,$4.27,-0.01,-0.234%,701860643.00,,2021,1343396,Technology,Computer Software: Prepackaged Software
RACE,Ferrari N.V. Common Shares,$211.35,-5.20,-2.401%,52320093008.00,,2015,152253,Capital Goods,Auto Manufacturing
RAD,Rite Aid Corporation Common Stock,$14.72,-0.28,-1.867%,810877873.00,United States,,1273245,Health Care,Medical/Nursing Services
RAMP,LiveRamp Holdings Inc. Common Stock,$46.72,-2.27,-4.634%,3173324436.00,United States,2018,127412,Technology,EDP Services
RBA,Ritchie Bros. Auctioneers Incorporated Common Stock,$60.92,-1.26,-2.026%,6723829100.00,Canada,,282303,,
RBAC,RedBall Acquisition Corp. Class A Ordinary Shares,$9.83,-0.02,-0.203%,706531250.00,United States,2020,38956,Finance,Business Services
RBC,Regal Beloit Corporation Common Stock,$147.70,-0.75,-0.505%,6010953103.00,United States,,213631,Consumer Durables,Metal Fabrications
RBLX,Roblox Corporation Class A Common Stock,$77.8199,-2.1701,-2.713%,44758288712.00,,2021,3721650,Technology,EDP Services
RBOT,Vicarious Surgical Inc. Class A Common Stock,$13.365,-0.445,-3.222%,576365625.00,Hong Kong,2020,248839,Health Care,Industrial Specialties
RC,Ready Capital Corproation Common Stock,$15.15,-0.14,-0.916%,1079157028.00,United States,2013,309471,Consumer Services,Real Estate Investment Trusts
RC^C,Ready Capital Corporation 6.25% Series C Cumulative Convertible Preferred Stock,$25.26,0.00,0.00%,,United States,,5,,
RC^E,Ready Capital Corporation 6.50% Series E Cumulative Redeemable Preferred Stock,$25.46,-0.01,-0.039%,,United States,,7093,,
RCA,Ready Capital Corporation 7.00% Convertible Senior Notes due 2023,$26.65,-0.29,-1.076%,0.00,United States,2017,5521,Consumer Services,Real Estate Investment Trusts
RCB,Ready Capital Corporation 6.20% Senior Notes due 2026,$25.90,-0.02,-0.077%,0.00,United States,2019,4312,,
RCC,Ready Capital Corporation 5.75% Senior Notes due 2026,$25.51,0.01,0.039%,0.00,United States,2021,4683,Finance,Finance Companies
RCI,Rogers Communication Inc. Common Stock,$46.67,-0.57,-1.207%,23564864591.00,Canada,,111325,,
RCL,D/B/A Royal Caribbean Cruises Ltd. Common Stock,$92.65,0.24,0.26%,23597418371.00,United States,1993,2447837,,
RCS,PIMCO Strategic Income Fund Inc.,$7.13,-0.185,-2.529%,316550610.00,United States,1994,221466,Finance,Investment Managers
RCUS,Arcus Biosciences Inc. Common Stock,$37.71,0.03,0.08%,2692269135.00,,2018,256745,Health Care,Biotechnology: Pharmaceutical Preparations
RDN,Radian Group Inc. Common Stock,$22.83,0.02,0.088%,4236277565.00,United States,,609144,Finance,Property-Casualty Insurers
RDS/B,Royal Dutch Shell PLC,$44.28,0.45,1.027%,,Netherlands,,3224105,,
RDW,Redwire Corporation Common Stock,$10.15,0.16,1.602%,605561921.00,United States,2021,363310,Capital Goods,Military/Government/Technical
RDY,Dr. Reddy's Laboratories Ltd Common Stock,$64.73,0.07,0.108%,10736596155.00,India,,52102,Health Care,Biotechnology: Pharmaceutical Preparations
RE,Everest Re Group Ltd. Common Stock,$254.71,-4.18,-1.615%,10156002671.00,Bermuda,,77567,Finance,Property-Casualty Insurers
RELX,RELX PLC PLC American Depositary Shares (Each representing One Ordinary Share),$28.745,-0.875,-2.954%,55603803835.00,United Kingdom,2015,522062,Consumer Services,Publishing
RENN,Renren Inc. American Depositary Shares each representing fifteen Class A ordinary shares,$13.91,0.02,0.144%,334109242.00,China,2011,12458,Technology,EDP Services
RERE,AiHuiShou International Co. Ltd. American Depositary Shares (every three of which representing two Class A ordinary shares),$10.13,-0.18,-1.746%,2255290889.00,,2021,127773,,
RES,RPC Inc. Common Stock,$4.75,0.00,0.00%,1024695821.00,United States,,824104,Energy,Oilfield Services/Equipment
REV,Revlon Inc. New Common Stock,$10.34,-0.10,-0.958%,554769507.00,United States,1996,40531,Consumer Non-Durables,Package Goods/Cosmetics
REVG,REV Group Inc. Common Stock,$17.78,-0.05,-0.28%,1151208701.00,United States,2017,266563,Capital Goods,Industrial Machinery/Components
REX,REX American Resources Corporation,$80.16,-2.47,-2.989%,478630390.00,United States,,1998,Basic Industries,Automotive Aftermarket
REXR,Rexford Industrial Realty Inc. Common Stock,$57.39,0.26,0.455%,7904914784.00,United States,2013,506220,Consumer Services,Real Estate Investment Trusts
REXR^B,Rexford Industrial Realty Inc. 5.875% Series B Cumulative Redeemable Preferred Stock,$26.01,-0.08,-0.307%,,United States,,500,,
REXR^C,Rexford Industrial Realty Inc. 5.625% Series C Cumulative Redeemable Preferred Stock par value $0.01 per share,$26.48,-0.07,-0.264%,,United States,,6037,,
REZI,Resideo Technologies Inc. Common Stock ,$25.3745,-0.8855,-3.372%,3658570036.00,,2018,270831,Miscellaneous,Diversified Manufacture
RF,Regions Financial Corporation Common Stock,$21.81,0.05,0.23%,20818502286.00,United States,,4200549,Finance,Major Banks
RF^B,Regions Financial Corporation Depositary Shares Representing 1/40th Perpetual Preferred Series B,$27.77,-0.13,-0.466%,,United States,,79713,,
RF^C,Regions Financial Corporation Depositary Shares each Representing a 1/40th Interest in a  Share of 5.700% Fixed-to-Floating Rate Non-Cumulative  Perpetual Preferred Stock Series C,$28.04,-0.30,-1.059%,,United States,,27088,,
RF^E,Regions Financial Corporation Depositary Shares Each Representing a 1/40th Interest in a Share of 4.45% Non-Cumulative Perpetual Preferred Stock Series E,$25.56,-0.43,-1.654%,,United States,,42089,,
RFI,Cohen & Steers Total Return Realty Fund Inc. Common Stock,$16.31,-0.18,-1.092%,428478852.00,United States,1993,22342,Finance,Investment Managers
RFL,Rafael Holdings Inc. Class B Common Stock,$35.315,-0.635,-1.766%,729624392.00,United States,2018,68864,Health Care,Biotechnology: Pharmaceutical Preparations
RFM,RiverNorth Flexible Municipal Income Fund Inc. Common Stock,$23.39,-0.4178,-1.755%,143022810.00,,2020,12779,Finance,Trusts Except Educational Religious and Charitable
RFMZ,RiverNorth Flexible Municipal Income Fund II Inc. Common Stock,$20.13,-0.16,-0.789%,490200848.00,,2021,49563,Finance,Trusts Except Educational Religious and Charitable
RFP,Resolute Forest Products Inc. Common Stock,$12.11,0.18,1.509%,957793427.00,Canada,,257787,Basic Industries,Paper
RGA,Reinsurance Group of America Incorporated Common Stock,$111.21,-1.11,-0.988%,7561939364.00,United States,,131819,Finance,Life Insurance
RGR,Sturm Ruger & Company Inc. Common Stock,$74.86,-0.98,-1.292%,1317281476.00,United States,,40015,,
RGS,Regis Corporation Common Stock,$3.7981,0.0081,0.214%,136270271.00,United States,1991,1859320,,
RGT,Royce Global Value Trust Inc. Common Stock,$15.49,-0.19,-1.212%,86756268.00,,2013,1903,Finance,Trusts Except Educational Religious and Charitable
RH,RH Common Stock,$694.58,-9.94,-1.411%,14873428421.00,United States,2012,241664,Consumer Services,Other Specialty Stores
RHI,Robert Half International Inc. Common Stock,$102.81,-0.46,-0.445%,11511639915.00,United States,,229425,Technology,Diversified Commercial Services
RHP,Ryman Hospitality Properties Inc. (REIT),$86.66,-1.22,-1.388%,4771971204.00,United States,,133149,Consumer Services,Real Estate Investment Trusts
RIG,Transocean Ltd (Switzerland) Common Stock,$4.025,0.135,3.47%,2620838279.00,Switzerland,,27065115,Energy,Oil & Gas Production
RIO,Rio Tinto Plc Common Stock,$65.76,-1.78,-2.635%,106471793468.00,Australia,2002,3398016,Basic Industries,Steel/Iron Ore
RIV,RiverNorth Opportunities Fund Inc. Common Stock,$16.89,-0.02,-0.118%,219053639.00,,2015,73177,Finance,Finance Companies
RJF,Raymond James Financial Inc. Common Stock,$93.38,-1.09,-1.154%,43237080550.00,United States,,291241,Finance,Investment Bankers/Brokers/Service
RKLY,Rockley Photonics Holdings Limited Ordinary Shares,$8.25,0.16,1.978%,1041614120.00,,,465630,,
RKT,Rocket Companies Inc. Class A Common Stock,$16.4731,-0.5169,-3.042%,2279977658.00,United States,2020,2471378,Finance,Finance: Consumer Services
RKTA,Rocket Internet Growth Opportunities Corp. Class A Ordinary Shares,$9.66,-0.08,-0.821%,322402500.00,,2021,173,,
RL,Ralph Lauren Corporation Common Stock,$119.515,1.545,1.31%,8785470204.00,United States,1997,373116,Consumer Non-Durables,Apparel
RLGY,Realogy Holdings Corp. Common Stock,$18.08,-0.73,-3.881%,2107842354.00,United States,2012,550990,Finance,Real Estate
RLI,RLI Corp. Common Stock (DE),$101.07,-1.91,-1.855%,4570986059.00,United States,,26130,Finance,Property-Casualty Insurers
RLJ,RLJ Lodging Trust Common Shares of Beneficial Interest $0.01 par value,$15.00,-0.15,-0.99%,2499278625.00,United States,2011,315408,Consumer Services,Real Estate Investment Trusts
RLJ^A,RLJ Lodging Trust $1.95 Series A Cumulative Convertible  Preferred Shares,$29.30,0.05,0.171%,,United States,,172555,,
RLX,RLX Technology Inc. American Depositary Shares each representing the right to receive one (1) Class A ordinary share,$4.515,-0.055,-1.204%,7092119424.00,,2021,1434995,Consumer Non-Durables,Farming/Seeds/Milling
RM,Regional Management Corp. Common Stock,$63.20,-0.49,-0.769%,650542058.00,United States,2012,33244,Finance,Finance: Consumer Services
RMAX,RE/MAX Holdings Inc. Class A Common Stock,$31.29,-0.63,-1.974%,591099985.00,,2013,31591,Finance,Real Estate
RMD,ResMed Inc. Common Stock,$264.07,-6.43,-2.377%,38470030787.00,United States,,282281,Health Care,Medical/Dental Instruments
RMI,RiverNorth Opportunistic Municipal Income Fund Inc. Common Stock,$23.2482,-0.1518,-0.649%,148167009.00,,2018,9259,Finance,Finance/Investors Services
RMM,RiverNorth Managed Duration Municipal Income Fund Inc. Common Stock,$19.87,-0.22,-1.095%,392224203.00,,2019,37511,Finance,Trusts Except Educational Religious and Charitable
RMO,Romeo Power Inc. Class A Common Stock,$5.055,-0.555,-9.893%,677656214.00,,2019,5192979,Capital Goods,Automotive Aftermarket
RMPL^,RiverNorth Specialty Finance Corporation 5.875% ,$25.60,-0.20,-0.775%,,,,400,,
RMT,Royce Micro-Cap Trust Inc. Common Stock,$11.59,-0.23,-1.946%,513743347.00,United States,,49069,Finance,Investment Managers
RNG,RingCentral Inc. Class A Common Stock,$214.23,-5.77,-2.623%,19604189228.00,,2013,679715,Technology,EDP Services
RNGR,Ranger Energy Services Inc. Class A Common Stock,$8.7601,-0.0099,-0.113%,156777004.00,United States,2017,2322,Energy,Oilfield Services/Equipment
RNP,Cohen & Steers REIT and Preferred and Income Fund Inc. Common Shares,$25.68,-0.38,-1.458%,1222115155.00,United States,2003,95538,Finance,Investment Managers
RNR,RenaissanceRe Holdings Ltd. Common Stock,$138.73,-1.07,-0.765%,6534930616.00,Bermuda,,292662,Finance,Property-Casualty Insurers
RNR^F,RenaissanceRe Holdings Ltd. Depositary Shares each Representing a 1/1000th Interest in a 5.750% Series F Preference Share,$26.80,-0.13,-0.483%,,Bermuda,,17776,,
RNR^G,RenaissanceRe Holdings Ltd. Depositary Shares each representing a 1/1000th interest in a share of 4.20% Series G Preference Shares,$24.96,-0.34,-1.344%,,Bermuda,,65067,,
ROG,Rogers Corporation Common Stock,$192.78,0.02,0.01%,3610603995.00,United States,,52261,Capital Goods,Industrial Machinery/Components
ROK,Rockwell Automation Inc. Common Stock,$297.71,-5.12,-1.691%,34542017697.00,United States,,198496,Capital Goods,Industrial Machinery/Components
ROL,Rollins Inc. Common Stock,$35.54,-1.04,-2.843%,17488497967.00,United States,,600410,Technology,Industrial Specialties
RONI,Rice Acquisition Corp. II Class A Ordinary Shares,$9.8925,-0.0175,-0.177%,341315981.00,,2021,216201,,
ROP,Roper Technologies Inc. Common Stock,$453.62,-8.11,-1.756%,47822364115.00,United States,1992,129129,Capital Goods,Office Equipment/Supplies/Services
ROSS,Ross Acquisition Corp II Class A Ordinary Shares,$9.72,0.00,0.00%,419175000.00,,2021,18912,,
RPAI,Retail Properties of America Inc. Class A Common Stock,$12.7946,0.0046,0.036%,2748252815.00,United States,2012,281656,Consumer Services,Real Estate Investment Trusts
RPM,RPM International Inc. Common Stock,$78.65,-0.63,-0.795%,10206583609.00,United States,,122984,Basic Industries,Paints/Coatings
RPT,RPT Realty Common Stock,$12.81,0.03,0.235%,1039831280.00,United States,,130653,Consumer Services,Real Estate Investment Trusts
RPT^D,RPT Realty 7.25% ,$59.82,0.17,0.285%,,United States,,2393,,
RQI,Cohen & Steers Quality Income Realty Fund Inc Common Shares,$14.8858,-0.2342,-1.549%,1998317858.00,United States,2002,486701,Finance,Trusts Except Educational Religious and Charitable
RRC,Range Resources Corporation Common Stock,$21.71,-0.50,-2.251%,5422589437.00,United States,,3860582,Energy,Oil & Gas Production
RRD,R.R. Donnelley & Sons Company Common Stock,$4.965,0.015,0.303%,361452000.00,United States,,445350,Consumer Services,Advertising
RS,Reliance Steel & Aluminum Co. Common Stock (DE),$146.63,1.23,0.846%,9308541029.00,United States,1994,106105,Basic Industries,Steel/Iron Ore
RSF,RiverNorth Specialty Finance Corporation,$19.32,0.02,0.104%,88028933.00,,2019,9021,Finance,Investment Managers
RSG,Republic Services Inc. Common Stock,$120.83,-1.98,-1.612%,38468025309.00,United States,1998,494189,Public Utilities,Environmental Services
RSI,Rush Street Interactive Inc. Class A Common Stock,$19.75,0.35,1.804%,4328755408.00,,2020,885638,Consumer Services,Services-Misc. Amusement & Recreation
RSKD,Riskified Ltd. Class A Ordinary Shares,$23.93,-1.75,-6.815%,3771978167.00,,2021,519984,,
RTX,Raytheon Technologies Corporation Common Stock,$87.17,-0.17,-0.195%,131441733192.00,United States,,2680233,Capital Goods,Military/Government/Technical
RVI,Retail Value Inc. Common Stock ,$26.25,0.00,0.00%,554325188.00,United States,2018,25132,Consumer Services,Real Estate Investment Trusts
RVLV,Revolve Group Inc. Class A Common Stock,$65.61,-3.36,-4.872%,4774051420.00,,2019,348514,Consumer Services,Catalog/Specialty Distribution
RVT,Royce Value Trust Inc. Common Stock,$18.33,-0.27,-1.452%,1893443762.00,United States,1986,102294,Finance,Trusts Except Educational Religious and Charitable
RWT,Redwood Trust Inc. Common Stock,$12.85,-0.12,-0.925%,1452762173.00,United States,1995,568948,Consumer Services,Real Estate Investment Trusts
RXN,Rexnord Corporation Common Stock,$63.47,-0.68,-1.06%,7687742882.00,United States,2012,434741,Technology,Industrial Machinery/Components
RY,Royal Bank Of Canada Common Stock,$99.64,-1.71,-1.687%,141959015309.00,Canada,,957547,,
RY^T,Royal Bank Of Canada 6.750% Fixed Rate/Floating Rate Noncumulative First Preferred Shares Series C-2,$28.32,0.1074,0.381%,,Canada,,855,,
RYAM,Rayonier Advanced Materials Inc. Common Stock,$7.69,-0.03,-0.389%,490140245.00,United States,2014,116016,Basic Industries,Industrial Specialties
RYAN,Ryan Specialty Group Holdings Inc. Class A Common Stock,$33.25,-0.58,-1.714%,3654303578.00,,2021,127764,,
RYB,RYB Education Inc. American depositary shares each representing one Class A ordinary share,$2.7835,-0.0965,-3.351%,76786594.00,,2017,2773,Miscellaneous,Other Consumer Services
RYI,Ryerson Holding Corporation Common Stock,$22.76,-0.66,-2.818%,875681759.00,United States,2014,73640,Capital Goods,Office Equipment/Supplies/Services
RYN,Rayonier Inc. REIT Common Stock,$35.84,-0.73,-1.996%,5065088072.00,United States,,188268,Consumer Services,Real Estate Investment Trusts
RZA,Reinsurance Group of America Incorporated 6.20% Fixed-to-Floating Rate Subordinated Debentures due 2042,$26.01,-0.07,-0.268%,0.00,United States,,46744,Finance,Life Insurance
RZB,Reinsurance Group of America Incorporated 5.75% Fixed-To-Floating Rate Subordinated Debentures due 2056,$28.18,-0.35,-1.227%,0.00,United States,2016,12836,Finance,Life Insurance
S,SentinelOne Inc. Class A Common Stock,$54.67,-2.43,-4.256%,14489297472.00,,2021,7787801,Technology,EDP Services
SA,Seabridge Gold Inc. Ordinary Shares (Canada),$15.67,-0.22,-1.385%,1207442385.00,Canada,,108640,,
SAFE,Safehold Inc. Common Stock,$72.83,-0.75,-1.019%,3887081085.00,United States,2017,122710,Consumer Services,Real Estate
SAH,Sonic Automotive Inc. Common Stock,$55.045,-1.575,-2.782%,2296254358.00,United States,1997,184716,Consumer Services,Other Specialty Stores
SAIC,SCIENCE APPLICATIONS INTERNATIONAL CORPORATION Common Stock,$86.47,-0.32,-0.369%,4977747585.00,,,46729,Technology,EDP Services
SAIL,SailPoint Technologies Holdings Inc. Common Stock,$44.23,-1.50,-3.28%,4110826075.00,United States,2017,300049,Technology,Computer Software: Prepackaged Software
SAK,Saratoga Investment Corp 7.25% Notes due 2025,$25.95,0.05,0.193%,0.00,United States,2020,200,Finance,Finance Companies
SAM,Boston Beer Company Inc. (The) Common Stock,$513.01,-10.89,-2.079%,6300683653.00,United States,,108514,Consumer Non-Durables,Beverages (Production/Distribution)
SAN,Banco Santander S.A. Sponsored ADR (Spain),$3.63,-0.12,-3.20%,62844471994.00,Spain,,2178194,Finance,Commercial Banks
SAND          ,Sandstorm Gold Ltd. Ordinary Shares (Canada),$5.87,-0.03,-0.508%,1144007922.00,Canada,,1435061,,
SAP,SAP  SE ADS,$137.89,-4.61,-3.235%,162652195193.00,Germany,,442803,Technology,EDP Services
SAR,Saratoga Investment Corp New,$28.49,-0.58,-1.995%,318617089.00,United States,,52157,Finance,Investment Managers
SAVE,Spirit Airlines Inc. Common Stock,$27.065,-0.025,-0.092%,2933896070.00,United States,,2066983,Transportation,Air Freight/Delivery Services
SB,Safe Bulkers Inc Common Stock ($0.001 par value),$5.04,0.10,2.024%,602221173.00,Monaco,2008,1633833,Transportation,Marine Transportation
SB^C,Safe Bulkers Inc Cumulative Redeemable Perpetual Preferred Series C (Marshall Islands),$25.36,-0.15,-0.588%,,Monaco,,125,,
SB^D,Safe Bulkers Inc Perpetual Preferred Series D (Marshall Islands),$25.50,-0.04,-0.157%,,Monaco,,831,,
SBBA,Scorpio Tankers Inc. 7.00% Senior Notes due 2025,$24.83,0.00,0.00%,0.00,Monaco,2020,3500,Transportation,Marine Transportation
SBH,Sally Beauty Holdings Inc. (Name to be changed from Sally Holdings Inc.) Common Stock,$17.83,0.14,0.791%,2015385879.00,United States,,332457,Miscellaneous,Diversified Commercial Services
SBI,Western Asset Intermediate Muni Fund Inc Common Stock,$9.74,-0.1599,-1.615%,137161748.00,United States,1992,6327,Finance,Finance/Investors Services
SBII,Sandbridge X2 Corp. Class A Common Stock,$9.7201,-0.0599,-0.612%,289388042.00,,2021,802,,
SBOW,SilverBow Resorces Inc. Common Stock,$25.01,0.79,3.262%,319130376.00,,,147172,Energy,Oil & Gas Production
SBR,Sabine Royalty Trust Common Stock,$42.89,-0.10,-0.233%,625308107.00,United States,,32329,Energy,Oil & Gas Production
SBS,Companhia de saneamento Basico Do Estado De Sao Paulo - Sabesp American Depositary Shares (Each repstg 250 Common Shares),$7.005,-0.085,-1.199%,4787986632.00,Brazil,2002,3006046,,
SBSW,D/B/A Sibanye-Stillwater Limited ADS,$12.17,-0.57,-4.474%,8762515238.00,,,4524124,Basic Industries,Precious Metals
SC,Santander Consumer USA Holdings Inc. Common Stock,$41.525,-0.005,-0.012%,12710214589.00,,2014,605325,Finance,Finance Companies
SCCO,Southern Copper Corporation Common Stock,$58.3135,-0.9365,-1.581%,45081074580.00,United States,,387602,Basic Industries,Precious Metals
SCD,LMP Capital and Income Fund Inc. Common Stock,$13.66,-0.31,-2.219%,244724132.00,United States,2004,20360,Finance,Trusts Except Educational Religious and Charitable
SCE^G,SCE Trust II Trust Preferred Securities,$24.97,-0.09,-0.359%,,United States,,18154,,
SCE^H,SCE Trust III Fixed/Floating Rate Trust Preference Securities,$25.6097,-0.0803,-0.313%,,United States,,2718,,
SCE^J,Southern California Edison Company 5.375% Fixed-to-Floating Rate Trust Preference Securities,$24.887,-0.163,-0.651%,,United States,,28270,,
SCE^K,Southern California Edison Company 5.45% Fixed-to-Floating Rate Trust Preference Securities,$25.10,-0.16,-0.633%,,United States,,13593,,
SCE^L,SCE TRUST VI,$24.68,-0.17,-0.684%,,United States,,23227,,
SCHW,Charles Schwab Corporation (The) Common Stock,$75.75,-1.63,-2.106%,143016195132.00,United States,,4382289,Finance,Investment Bankers/Brokers/Service
SCHW^D,The Charles Schwab Corporation Depositary Shares each representing 1/40th interest in a share of 5.95% Non-Cumulative Perpetual Preferred Stock Series D,$25.43,-0.04,-0.157%,,United States,,25193,,
SCHW^J,The Charles Schwab Corporation Depositary Shares Each Representing a 1/40th Interest in a Share of 4.450% Non-Cumulative Perpetual Preferred Stock Series J,$25.90,-0.21,-0.804%,,United States,,57311,,
SCI,Service Corporation International Common Stock,$60.295,-0.965,-1.575%,10104146019.00,United States,,690039,Miscellaneous,Other Consumer Services
SCL,Stepan Company Common Stock,$113.18,0.33,0.292%,2542686148.00,United States,,16089,Consumer Non-Durables,Package Goods/Cosmetics
SCM,Stellus Capital Investment Corporation Common Stock,$13.36,-0.08,-0.595%,260333000.00,United States,2012,15072,Finance,Finance/Investors Services
SCS,Steelcase Inc. Common Stock,$13.025,0.075,0.579%,1506731375.00,United States,1998,412400,Consumer Durables,Office Equipment/Supplies/Services
SCU,Sculptor Capital Management Inc. Class A Common Stock,$27.79,-0.01,-0.036%,1614719609.00,United States,,77247,Finance,Investment Managers
SCVX,SCVX Corp. Class A Ordinary Shares,$9.95,-0.01,-0.10%,286062500.00,,2020,4032,Finance,Business Services
SCX,L.S. Starrett Company (The) Common Stock,$11.84,-1.48,-11.111%,84155784.00,United States,,20801,Consumer Durables,Home Furnishings
SD,SandRidge Energy Inc. Common Stock,$13.08,-0.26,-1.949%,478581177.00,,2016,1457381,Energy,Oil & Gas Production
SDHY,PGIM Short Duration High Yield Opportunities Fund Common Shares,$18.51,-0.07,-0.377%,456698267.00,,2020,83684,Finance,Finance/Investors Services
SE,Sea Limited American Depositary Shares each representing one Class A Ordinary Share,$315.90,-20.36,-6.055%,174425688684.00,United States,2017,3202963,Technology,Computer Software: Prepackaged Software
SEAH,Sports Entertainment Acquisition Corp. Class A Common Stock,$10.005,-0.005,-0.05%,562781250.00,United States,2020,409144,,
SEAS,SeaWorld Entertainment Inc. Common Stock,$58.10,-0.23,-0.394%,4600294148.00,United States,2013,497032,Consumer Services,Movies/Entertainment
SEE,Sealed Air Corporation Common Stock,$56.855,-0.525,-0.915%,8522156565.00,United States,,366359,Basic Industries,Containers/Packaging
SEM,Select Medical Holdings Corporation Common Stock,$36.855,0.435,1.194%,4959803603.00,United States,2009,352762,Health Care,Hospital/Nursing Management
SEMR,SEMrush Holdings Inc. Class A Common Stock,$24.22,-1.04,-4.117%,3281732738.00,,2021,324102,Technology,EDP Services
SF,Stifel Financial Corporation Common Stock,$69.20,-1.18,-1.677%,7251317698.00,United States,,129133,Finance,Investment Bankers/Brokers/Service
SF^B,Stifel Financial Corporation Depositary Shares Each Representing 1/1000th  Interest in a Share of 6.25% Non-Cumulative  Preferred Stock Series B,$26.77,-0.22,-0.815%,,United States,,5641,,
SF^C,Stifel Financial Corporation Depositary Shares Each Representing 1/1000th Interest in a Share of 6.125% Non Cumulative Preferred Stock Series C,$27.345,-0.255,-0.924%,,United States,,7088,,
SF^D,Stifel Financial Corporation Depositary Shares Each Representing 1/1000th Interest in a Share of 4.50% Non-Cumulative Preferred Stock Series D,$25.03,-0.20,-0.793%,,United States,,49059,,
SFB,Stifel Financial Corporation 5.20% Senior Notes due 2047,$26.88,-0.16,-0.592%,0.00,United States,2017,9355,Finance,Investment Bankers/Brokers/Service
SFBS,ServisFirst Bancshares Inc. Common Stock,$79.995,0.065,0.081%,4335825314.00,United States,,51520,Finance,Major Banks
SFE,Safeguard Scientifics Inc. New Common Stock,$8.51,-0.07,-0.816%,177040398.00,United States,,76666,Finance,Finance/Investors Services
SFL,SFL Corporation Ltd,$8.26,0.11,1.35%,1140069484.00,Bermuda,,568548,Transportation,Marine Transportation
SFUN,Fang Holdings Limited American Depositary Shares (Each representing Four Class A Ordinary Shares HK$1.00 par value),$6.01,-0.09,-1.475%,54121354.00,China,2010,1344,Technology,EDP Services
SGFY,Signify Health Inc. Class A Common Stock,$19.27,-0.48,-2.43%,3237945654.00,,2021,1677220,Technology,Retail: Computer Software & Peripheral Equipment
SGU,Star Group L.P. Common Stock,$10.39,-0.06,-0.574%,411504470.00,United States,,18877,Public Utilities,Oil Refining/Marketing
SHAK,Shake Shack Inc. Class A Common Stock,$82.23,-1.59,-1.897%,3458385182.00,United States,2015,234330,Consumer Services,Restaurants
SHG,Shinhan Financial Group Co Ltd American Depositary Shares,$33.80,0.13,0.386%,17460850295.00,South Korea,,57211,Finance,Major Banks
SHI,SINOPEC Shangai Petrochemical Company Ltd. Common Stock,$24.6815,0.1915,0.782%,2671479529.00,China,,3874,Basic Industries,Major Chemicals
SHLX,Shell Midstream Partners L.P. Common Units representing Limited Partner Interests,$11.88,-0.32,-2.623%,4672279700.00,United States,2014,961496,Energy,Oilfield Services/Equipment
SHO,Sunstone Hotel Investors Inc. Sunstone Hotel Investors Inc. Common Shares,$12.295,-0.045,-0.365%,2693129468.00,United States,2004,1496222,Consumer Services,Real Estate Investment Trusts
SHO^H,Sunstone Hotel Investors Inc. 6.125% Series H Cumulative Redeemable Preferred Stock,$25.80,-0.09,-0.348%,,United States,,20767,,
SHO^I,Sunstone Hotel Investors Inc. 5.70% Series I Cumulative Redeemable Preferred Stock,$25.23,-0.12,-0.473%,,United States,,4916,,
